{
  "$schema":"https://json-schema.org/draft/2020-12/schema",
  "$id":"https://sinergy.system/schemas/commitment.envelope/v5",
  "title":"SINERGY CommitmentEnvelope v5",
  "type":"object",
  "additionalProperties":false,
  "$defs":{"hex64":{"type":"string","pattern":"^[a-fA-F0-9]{64}$"}},
  "required":["schema_version","canonical_profile","policy_profile","domain","network_domain","verifier_id","payload_schema","subject_id","sequence","as_of","payload_digest","previous_commitment","signer_policy","metadata_digest"],
  "properties":{
    "schema_version":{"const":"commitment.envelope/v5"},
    "canonical_profile":{"const":"sinergy.canonical-json/v1"},
    "policy_profile":{"const":"sinergy.commitment-schema-policy/v5"},
    "domain":{"type":"string","pattern":"^SINERGY:[A-Z0-9_]+$"},
    "network_domain":{"type":"string","minLength":1},
    "verifier_id":{"type":"string","minLength":1},
    "payload_schema":{"type":"string","minLength":1},
    "subject_id":{"type":"string","minLength":1},
    "sequence":{"type":"integer","minimum":0,"maximum":9007199254740991},
    "as_of":{"type":"string","pattern":"Z$"},
    "payload_digest":{"$ref":"#/$defs/hex64"},
    "previous_commitment":{"oneOf":[{"$ref":"#/$defs/hex64"},{"type":"null"}]},
    "signer_policy":{"type":"string","minLength":1},
    "metadata_digest":{"oneOf":[{"$ref":"#/$defs/hex64"},{"type":"null"}]}
  }
}
